Chunk_Text,Page_Number
"5,613,505 11 a faster thermal response for the susceptor, thereby favor- ably increasing the evolution rate of the aerosol flavor to more quickly heat the tobacco flavor medium. The discon- tinuities 410 allow the evolved aerosols to flow through the susceptor 400, increasing aerosol mass transfer in the desired flow direction. 12 FIGS. 11 and 13, the preferred C-shape of FIG. 2 is shown. Any other suitable geometry capable of producing an alter- nating ß field of sufficient strength can be employed. 5 The web W comprises or bears tobacco flavor medium. The web can have the general configuration described above in reference to FIGS. 8-10C. More specific embodiments will now be discussed with reference to FIGS. 12A-12G. The web W may be made of the tobacco flavor medium TM itself, formed into an elongated sheet form by methods that are well known in, e.g., the manufacture of reconstituted tobacco products, as shown is FIG. 12A. The tobacco flavor medium is mixed with susceptor material SM as discussed above in reference to FIG. 8 if the web is used in the embodiment of FIG. 11, and, if desired, with the embodi- ment of FIG. 13 employing a separate susceptor element. Such an alternative may be sufficient in some applications, depending on the smoking article, and the amount of friction and tension expected from web advancement. If the con- figuration is such that an unsupported web may break, especially after heating when the web is weakened, then an alternative like that shown in FIG. 12B may be used. As shown in FIG. 12B, web W is a laminate of tobacco flavor medium TM and a support layer 531. Support layer 531 may be a woven or non-woven carbon fiber mat, for which suitable carbon fibers might be one-inch-long chopped car- bon fibers available from Akzo Fortafil, Inc., of Rockwood, Tenn., a subsidiary of Akzo America, Inc., of Chicago, Ill., as FORTAFIL®3C. Layer 531 may also be any other suitable material e.g., suitably treated paper that adds strength to layer TM and can withstand the temperatures to which layer TM will be heated without generating subjective off tastes. Support layer 531 can function as a susceptor as described above in reference to FIG. 9 if the proper material is selected. If so, tobacco flavor medium layer TM can be provided with susceptor material SM or not, depending on whether the eddy currents generated in the susceptor support layer 531 are sufficient to adequately heat layer TM. Referring to FIG. 10C, an embodiment is shown com- prising a laminate of tobacco flavor medium TM, a layer of susceptor material SM, and a paper overwrap 310. The embodiment is similar to the embodiment of FIG. 8 except 10 that the layer of susceptor material SM comprises discrete portions of susceptor material separated by gaps. Thus gaps are relatively uniform as shown or can be tapered either toward paper overwrap 310 or the layer of tobacco flavor medium TM. 15 The discrete susceptor layer 300 described above can also have discontinuities and can take the form of a screen, mesh or perforated foil. For example, a paper foil laminate can be employed wherein strips of foil are provided. If an imper- meable susceptor layer is employed, a vapor barrier is 20 typically produced between the susceptor layer and the tobacco flavor medium TM. This vapor barrier reduces the heat transfer from the susceptor layer to the tobacco flavor medium. The presence of discontinuities permits the con- stituents which comprise the vapor barrier to pass through 25 the susceptor. This discontinuous susceptor can be employed to heat tobacco flavor medium in any desired geometrical shape for smoking. For example, the tobacco flavor medium can be in the form of a filled or hollow cylinder, as described in Ser. 30 No. 118,665 or a web such as that discussed in Ser. No. 08/105,346. As discussed above, to heat respective regions of the tobacco flavor medium to generate respective puffs, either the induction source is indexed relative to the tobacco flavor medium, or visa versa, or both are moved relative to each other. Preferred embodiments wherein the tobacco flavor medium is indexed relative to a stationary induction heating source are found in commonly assigned patent application Ser. No. 08/105,346. 35 It may be found that additional support is needed beyond that provided by support layer 531. As shown in FIG. 12C, web W further includes reinforcing strip 541. Strip 541 may be paper, metallic foil, or a foil/paper laminate. As seen in FIG. 12D, further support can be provided by a second reinforcing strip 551 similar to strip 541. 40 Ser. No. 08/105,346 discloses a system for registering a web of tobacco flavor medium in thermal proximity with an electrical resistance heat source. A portion of the web is supported in thermal proximity to the heat source, heated to generate a tobacco flavor substance, and then advanced past this registry point. If a supply of web is provided, this advancement results in a subsequent web portion being registered with the electrical heating source. 45 In another alternative embodiment, it may be found that strip 541, or the combination of strips 541, 551 is sufficient to support continuous tobacco flavor medium strip and two such alternate embodiments are shown in FIGS. 12E and 12F. As shown generally in FIGS. 11 and 13, a smoking article 50 500 has a powered capstan 502 driven by appropriate motor and gearing and an unpowered capstan 504. A supply of a web W of tobacco flavor medium is spun on a spool mounted on unpowered capstan 504 and is guided from the supply spool over an idle guide roller 510, into registry with an 55 induction heating source generally designated as IS, over idle guide rollers 512 and 514, to a take-up spool mounted on and driven by powered capstan 502. The registered web, described in greater detail below, is heated by susceptor(s) inductively heated by source IS to generate an aerosol in chamber 516 which is drawn by the smoker via mouthpiece 518. Another embodiment of a flavor web according to this invention is shown in FIG. 12G. In this embodiment, indi- vidual portions 591 of tobacco flavor medium TM are deposited on a carrier web 592. Any of the alternative structures shown in FIGS. 12B-12F can be used in this embodiment. This embodiment requires greater accuracy in web transport than the first embodiment, so that portions 591 are in inductive registry with the alternating magnetic field. However, depending on the relative heat conductivities of the various web materials, both embodiments must be 60 advanced approximately the same distance between puffs, as discussed above, to prevent reheating of tobacco flavor medium to avoid generation of off-tastes. The induction heating source IS can be any induction heating source according to the present invention. More specifically, the C-shaped or E-shaped induction heating 65 source 10 of FIGS. 1 and 2 or the induction heating source of FIGS. 6 and 7 having a split ring 222 are employed. In An alternative embodiment is shown in FIG. 13 wherein induction heating source IS inductively heats one or two susceptor elements of susceptor material SM located near, or contacting the web W travel, between the supply and take-up reels 502 and 504. The discrete element of any suitable",94
"5,613,505 13 susceptor material SM heats the web W which is in intimate thermal contact therewith. In the configuration shown, the susceptor roller(s) 515 is in the chamber 516 and is fixed relative to the web. Roller 515 can rotate to advance the web and can also translate slightly with the web to reduce tension 5 on the web. Web W can be any of the previously discussed embodiments of FIGS. 12A-12G and can contain additional susceptor material as described if necessary to adequately heat the tobacco flavor medium. 14 A preferred embodiment for providing a susceptor to inductively heat the tobacco flavor medium is now dis- cussed. This embodiment is applicable to tobacco flavor medium in the form of a cylindrical shape, a web, or any other suitable geometric shape to be smoked. of volatile flavor components. The curing can be accelerated by slightly elevating the curing temperature. The resulting susceptor patterns are flexible, permitting use with tobacco flavor medium substrates which are later rolled, bent or otherwise fabricated to achieve a specific geometry. The printed susceptor has a low mass, thus decreasing the amount of energy stored in the susceptor mass and resulting in greater heater transfer efficiency to the substrates. The susceptor ink can be applied using conventional printing technology such as the discussed screen or gravure printing. The printing and the rheological characteristics of the ink result in an integration of the heater film into the tobacco flavor medium substrate. This integration results in an intimate contact between the susceptor materials and the substrate, resulting in good thermal transfer via conduction. Also, such an integrated, printed susceptor is less likely to delaminate. 10 A susceptor material is employed having a high magnetic permeability and a low specific electrical resistivity such as any mentioned material which is capable of heating a tobacco substrate to temperatures necessary to produce aerosol delivery within a smoking device when exposed to an alternative magnetic field. For example aluminum or silver ink are employed. The susceptor is formed by mixing a food grade binder, e.g., a hydrocolloid such as pectin or Konjac, along with other minor components and a susceptor filler. The resulting ink is then applied in the desired geometry via a conventional method of application to the desired tobacco flavor medium and/or paper substrate. This ink can be used to fabricate susceptors of two general types. In the first case, the ink is cured by drying at low tempera- tures, e.g., about room temperature. This results in a sus- ceptor element which consists of conductive/resistive (per- meable) filler particles within the binder matrix. The time and temperature of curing determines the volumetric ratio of filler to binder and thus influences the measured reluctance of the element in accordance with percolation phenomena. This type of susceptor can be deposited and cured on substrates which cannot tolerate exposure to high tempera- tures, e.g., cellulose materials such as tobacco or paper. In the second case, the ink can be deposited on a high tem- perature substrate such as alumina and elevated to tempera- tures high enough and times long enough to oxidize the binder leaving a ""film"" composed of the susceptor material. The final magnetic reluctance will depend on the original loading of the filler in the ink, the filler material, the intimacy of the diffusion or flow of the filler material into the substrate surface, and the time temperature history of the deposited film. These parameters impact the final particle morphology which influences the resistance, apparent resis- tivity, of the element. 15 The amount of heat transferred depends on the type of susceptor material selected, the relative ratio of susceptor material to the ink, and the particular geometric pattern of ink employed. This pattern should be located on the tobacco flavor medium filler and paper such that the applied suscep- tor material is inductively registered with the generated magnetic field upon insertion and activation. 20 25 The susceptor ink can be applied as a uniform coating or layer as discussed in the above embodiments. Alternatively, a pattern can be printed for discrete regions, each region integrated and in intimate contact with a corresponding region of tobacco flavor medium sized to generate a puff. The printed susceptor regions are separated to avoid undes- ired induction heating of adjacent susceptor regions, e.g., the susceptor regions are spaced apart on a tobacco flavor medium substrate. 30 Regardless of the susceptor tobacco flavor medium con- figuration employed, the susceptor is in thermal contact with the tobacco flavor medium, i.e., these elements are located such that the inductively heated susceptor transfers a suffi- cient amount of heat to the tobacco flavor medium to evolve aerosols. 35 40 A simplified schematic is shown in FIG. 14 of an elec- trical smoking article employing an induction heater accord- ing to the present invention. The represented power source, e.g., a battery, 600, control circuitry 610, sensor 620 and optional motor/gearing 630 are described in greater detail in the noted related applications incorporated by reference herein. Sensor 620 generates a signal in response to the smoker drawing on the particular electrical article. The ""draw"" signal is fed to control circuitry 611 which sends a ""fire"" or discharge signal to the LC circuit 640. LC circuit 640 is powered by battery 600. The LC circuit 640 sends an alternating current to the single induction heater 650, or one or more of the plurality of heaters to generate the alternating magnetic field to heat the susceptor. Motor/gearing 630 is powered by battery 600 and activated by control circuitry 610 as described in Ser. No. 08/105,346 to register the induction heater or fixed susceptor with the moving web. Alternatively, motor/gearing 630 is used to move the ciga- rette and induction heater relative to one another as described. 45 The produced ink is applied to the paper and/or the tobacco flavor medium via screen printing, gravure printing, ink jet application, vapor disposition, vacuum disposition, plasma spraying, etc. 50 The susceptor ink is thus printed or otherwise deposited in paper and/or tobacco flavor medium. Preferably, the suscep- 55 tor is in contact with the tobacco flavor medium. If printed on paper, the susceptor is preferably in the side of the paper facing the tobacco flavor medium. The paper should be thick enough and/or have appropriate burn rate characteristics to minimize burning as the susceptor ink is heated. A paper 60 overwrap as discussed above can be employed. This embodiment offers several advantages. Various con- ventional food grade binders are used which are compatible with tobacco material. The curing of the ink is at room An exemplary control circuit shown in FIG. 15 consists of temperature, thereby simplifying the process and avoiding 65 a control circuitry 611 such as PWM (pulse width modu- undesired thermal post treatment of susceptors applied to the lated) control logic integrated circuit driver chip, which drives FET (Field Effect Transistor) driver transformers 615. tobacco flavor medium which could alter the concentrations Any appropriate circuit for generating an alternating current for the excitation coils to convert into an alternating magnetic field can be employed.",95
"5,613,505 15 The FET's 615, four as shown, are connected in a full bridge configuration. This preferential circuit topology is used to maximize the power transfer to the work excitation coil 614 while minimizing source impedance and reducing switching losses. The input supply voltage, depending on circuit 5 application, would range between 3 and 24 VDC. The power delivery from power supply 600 (shown in FIG. 14) to the work coil 614 is dynamically (realtime) monitored by the use of a current transformer 616. The scaled current from the current transformer 616 is routed into a first signal condi- tioning network 618 and converted into a voltage to provide an error signal to the PWM controller 611. The voltage scaled signal also feeds a second separate signal condition- ing network 622 which provides a varying DC signal related to the reflected impedance of the susceptor within a ciga- rette, and the susceptor's particular physical properties such as resistance, magnetic permeability, geometry, etc. This signal is routed into a circuit subsystem labelled signature processor 624. The cigarette susceptor's impedance is moni- tored upon cigarette insertion into the lighter subsystem, by 20 the application of less than 5% of the nominal applied power for short ""burst"" of a magnetic field having less strength than the magnetic field generated to heat the susceptor, i.e., the initial field is incapable of heating the susceptor. The ciga- rette susceptor reflects impedances into the work coil 614 dependent on the applied frequencies. The signature proces- 25 sor 624 compares the reflected load impedance with stored values in a ROM table at several arbitrary frequencies. The accuracy of discrimination of the cigarette susceptor, and 16 end legs extending in the same direction from a common section, wherein said coil is spiraled around the common section. 5. The heating system according to claim 2, wherein said ferrite structure comprises a ring defining a hollow annular interior and said excitation coil is wound through the annular interior, said ring encircling the tobacco flavor medium. 6. The heating system according to claim 5, further comprising a magnetically permeable spacer located in the hollow interior between said excitation coil and said ring. 10 7. The heating system according to claim 1, wherein said susceptor element is aluminum, conductive carbon, graphite, stainless steel, copper, bronze or a combination thereof. 8. A heating system for an electrical smoking article for smoking a tobacco flavor medium in thermal proximity to a susceptor material, the heating system further comprising: a controller which activates said induction source. 15 9. The heating system according to claim 8, wherein said controller comprises means for activating said induction source at a desired time and for deactivating said induction source after a predetermined period. 10. The heating system according to claim 8, wherein said controller is responsive to a draw upon the smoking article. 11. The heating system according to claim 8, further comprising a means for determining whether an appropriate susceptor material is present, said determining means acti- vating said controller only if an appropriate susceptor mate- rial is present. 12. The heating system according to claim 8, wherein said controller applies an initial alternating magnetic field to an detection of off-specification cigarettes or foreign objects is 30 intended location of the susceptor material, the initial mag- based on the number of test frequencies used and the tolerance window allowed for each test response. The sig- nature processor 624 provides a ""GO/NO-GO"" permissive signal to a power delivery control and logic subsystem 612 of the lighter, which then controls the synchronization and 35 susceptor material. on-time operation of the PWM control logic driver chip 611. The signature processor 624 also detects unexpected energy delivery to the susceptor due to a significant shift in detected susceptor's physical properties and interrupts operation of the lighter by turning off the PWM controller chip 611 via 40 subsystem 612. netic field being incapable of inductively heating the sus- ceptor material, and said controller determines whether to apply the alternating magnetic field based upon a reflection of the initial magnetic field indicating presence of a desired 13. The heating system according to claim 8, wherein said controller is connected to a detector for measuring a physical property and deactivates said induction source in response to a shift in a detected characteristic of the susceptor material. 14. The heating system according to claim 8, wherein the tobacco flavor medium comprises a web having tobacco flavor medium therealong; and the system further comprises means for supporting a section of said web in thermal proximity to the susceptor material within the alternating 45 magnetic field of the induction source; and means for advancing said web to present a successive section having said tobacco medium in thermal proximity to the susceptor material therealong within the alternating magnetic field of the induction source. Many substitutions, modifications and improvements may be apparent to the skilled artisan without departing from the spirit and scope of the present invention as described and defined in the specification and following claims. We claim: 1. A heating system for an electrical smoking article for smoking tobacco flavor medium comprising: a generator for producing an alternating magnetic field, a susceptor material which is inductively heatable by the alternating magnetic field and positioned relative to the generator so as to be heatable by the alternating mag- netic field, and 50 15. The heating system according to claim 1, further comprising a hollow region for allowing a draw by a smoker, and means for activating the generation of an alternating magnetic field by said induction heater in response to a draw by a smoker. a tobacco flavor medium in thermal proximity to the susceptor material. 55 16. A heating system as claimed in claim 15, wherein the hollow region is a mouthpiece or an opening for the insertion of a cigarette. 2. The heating system according to claim 1, wherein said generator comprises: a ferrite structure; and 17. The heating system according to claim 1, wherein the tobacco flavor medium comprises a web having tobacco an excitation coil wrapped around said ferrite structure. 60 flavor medium therealong; and wherein the heating system 3. The heating system according to claim 2, wherein the ferrite structure comprises an E-shaped structure having two end legs and a middle leg extending in the same direction from a common section, wherein said excitation coil is spiraled around the middle leg. further comprises means for supporting a section of said web in thermal proximity to the susceptor material within the alternating magnetic field of the induction source and means for advancing said web to present a successive section having said tobacco medium in thermal proximity to the susceptor material therealong within the alternating mag- netic field of the induction source. 65 4. The heating system according to claim 2, wherein the ferrite structure comprises a C-shaped structure having two",96
