Chunk_Text,Page_Number
"1 EP 3 821 723 A1 2 Description TECHNICAL FIELD [0001] One or more exemplary embodiments of the present disclosure relate to an aerosol generating device, and more particularly, to an aerosol generating device having a structure that a user is unable to disassemble arbitrarily. BACKGROUND ART [0002] Recently, the demand for alternative methods to overcome the shortcomings of general cigarettes has increased. For example, there is an increasing demand for a method of generating aerosol by heating an aerosol generating material in cigarettes, rather than by burning cigarettes. Accordingly, studies on a heating-type ciga- rette or a heating-type aerosol generating device have been actively conducted. [0003] A non-combustion aerosol generating device refers to an apparatus which generates aerosols from an aerosol generating material included in a cigarette by heating the cigarette to a certain temperature without burning the cigarette, and allows a user to inhale the gen- erated aerosols with air. [0004] The non-combustion aerosol generating device is provided with a heater for heating the cigarette therein. Since the heater is heated to a high temperature, when the user disassembles the apparatus arbitrarily, the user may be easily exposed to a risk of being burned. [0005] It is to be appreciated that the above-described background art is technical information kept by the in- ventors to obtain exemplary embodiments of the present disclosure or acquired by the inventors in the process of obtaining the exemplary embodiments, thus the back- ground art may not have been known to the general public before the application of the exemplary embodiments of the present disclosure. DESCRIPTION OF EXEMPLARY EMBODIMENTS TECHNICAL PROBLEM [0007] In addition, one or more exemplary embodi- ments of the present disclosure may provide aerosols containing rich flavors, nicotine, and the like by passing the aerosols generated by heating an aerosol generating source through a cigarette. SOLUTION TO PROBLEM [0008] An exemplary embodiment of the present dis- closure provides an aerosol generating device including: a case in which a heater for heating a cigarette is installed; a bracket for supporting components installed inside the case; a fastening member for fastening the case and the bracket; and a cap that is installed on an outer surface of the case in an inseparable manner to conceal the fas- tening member in the case. 5 [0009] In an exemplary embodiment, the cap includes a hook portion protruding in the lengthwise direction of the cigarette, wherein the hook portion may include a 10 locking jaw protruding toward the inner surface of the case. [0010] In an exemplary embodiment, the case may in- clude a seating portion protruding toward the hook por- tion to seat the cap. 15 [0011] In an exemplary embodiment, when the cap is installed in the case, the seating portion may be engaged with the locking jaw, thus restricting upward movement of the cap upward. 20 [0012] In an exemplary embodiment, the surface where the seating portion and the locking jaw contact each other may be extended in a direction parallel to the width direction of the cigarette. [0013] In an exemplary embodiment, the aerosol gen- erating device may further include a stopper that is in- 25 stalled on the inner surface of the case, presses the hook portion in the direction in which the locking jaw protrudes, and thus restricts movement of the hook portion in the direction in which the seating portion protrudes. [0014] In an exemplary embodiment, the locking jaw may include an inclined surface such that the seating portion slides on the inclined surface while the cap is being installed in the case. 30 [0015] In an exemplary embodiment, the seating por- tion may include a sliding surface such that the locking jaw slides on the sliding surface while the cap is being installed in the case. 35 [0016] In an exemplary embodiment, the aerosol gen- erating device may further include a sealing member in- terposed between the case and the cap to seal the inside 40 of the case. [0017] In an exemplary embodiment, the case includes an upper case where the cigarette is inserted and heated and a lower case supporting and protecting various com- ponents installed therein, wherein the contact surfaces of the upper case and the cap, and of the upper case and the lower case may be joined by ultrasonic welding. 45 [0006] One or more exemplary embodiments of the present disclosure provide an aerosol generating device having a structure that a user is unable to disassemble arbitrarily. [0018] In an exemplary embodiment, the hook portion further includes an extension member extending in the lengthwise direction of the cigarette further than the lock- ing jaw, and the stopper may press the extension member in the direction in which the locking jaw protrudes. [0019] In an exemplary embodiment, along the length- wise direction of the cigarette, the length of the extension member may be greater than the distance from the stop- per to the surface where the seating portion and the cap contact each other. 50 55 [0020] In an exemplary embodiment, along the length- wise direction of the cigarette, the width of the locking 2",39
"3 EP 3 821 723 A1 4 jaw may be less than or equal to the distance from the surface where the locking jaw and the seating portion engage with each other to the stopper. [0021] In an exemplary embodiment, along the width direction of the cigarette, the width of the hook portion excluding the locking jaw may be less than the distance from the stopper to the locking jaw. example of some components of the aerosol gener- ating device, according to the exemplary embodi- ment shown in FIG. 8. 5 BEST MODE [0022] In the present an exemplary embodiment, along the width direction of the cigarette, the width of the hook portion including the locking jaw may be greater than the distance from the stopper to the locking jaw. [0023] It is to be appreciated that the present disclo- sure is not limited to the above-described exemplary em- bodiments, and other features and advantages of the ex- emplary embodiments will be more fully understood from the following detailed description taken in conjunction with the accompanying drawings, without departing from the true scope and spirit of the appended claims. 10 a bracket for supporting components installed in the case; a fastening member for fastening the case and the bracket; and a cap that is installed on the outer surface of the case to conceal the fastening member in the case, and inseparable after installation. 15 ADVANTAGEOUS EFFECTS OF DISCLOSURE [0027] An exemplary embodiment of the present dis- closure provides an aerosol generating device including: a case in which a heater for heating a cigarette is installed; MODE OF DISCLOSURE [0028] With respect to the terms in the various exem- plary embodiments, the general terms which are current- ly and widely used are selected in consideration of func- tions of structural elements in the various exemplary em- bodiments of the present disclosure. However, meanings of the terms can be changed according to intention, a judicial precedence, the appearance of a new technolo- 20 [0024] As described above, one or more exemplary embodiments of the present disclosure may provide an aerosol generating device having a structure that a user is unable to disassemble arbitrarily since the user is un- able to have access to a fastening member installed in a case due to an inseparable coupling structure of the case and cap. 25 gy, and the like. In addition, in certain cases, a term which is not commonly used can be selected. In such a case, the meaning of the term will be described in detail at the corresponding portion in the description of the present disclosure. Therefore, the terms used in the various ex- emplary embodiments of the present disclosure should be defined based on the meanings of the terms and the descriptions provided herein. [0025] In addition, the aerosol generating device may provide aerosols containing flavors, nicotine, and the like suitable for the user by passing the flow of the aerosols generated from an aerosol generating source through a cigarette. 30 BRIEF DESCRIPTION OF DRAWINGS [0029] In addition, unless explicitly described to the contrary, the word ""comprise"" and variations such as ""comprises"" or ""comprising"" will be understood to imply the inclusion of stated elements but not the exclusion of any other elements. In addition, the terms ""-er"", ""-or"", and ""module"" described in the specification mean units for processing at least one function and operation and can 35 [0026] FIGS. 1 through 3 are diagrams showing examples in which a cigarette is inserted into an aerosol gen- erating device. 40 be implemented by hardware components or software components and combinations thereof. FIG. 4 illustrates an example of the cigarette. FIG. 5 is a perspective view illustrating an operating state of the aerosol generating device according to an exemplary embodiment. 45 [0030] Hereinafter, the present disclosure will now be described more fully with reference to the accompanying drawings, in which exemplary embodiments of the present disclosure are shown such that one of ordinary skill in the art may easily work the present disclosure. The disclosure may, however, be embodied in many dif- ferent forms and should not be construed as being limited to the exemplary embodiments set forth herein. FIG. 6 is a perspective view illustrating an operating state in which some components are separated from the aerosol generating device, according to the ex- emplary embodiment shown in FIG. 5. FIG. 7 is an exploded perspective view illustrating some components of the aerosol generating device disassembled, according to the exemplary embodi- ment shown in FIG. 5. 50 [0031] Hereinafter, exemplary embodiments of the present disclosure will be described in detail with refer- ence to the drawings. FIG. 8 is a cross-sectional view illustrating a coupling relationship of some components of the aerosol gen- erating device, according to the exemplary embod- iment shown in FIG. 5. [0032] FIGS. 1 through 3 are diagrams showing exam- ples in which a cigarette is inserted into an aerosol gen- erating device. 3 55 [0033] Referring to FIG. 1, the aerosol generating de- vice 1000 may include a battery 1010, a controller 1020, and a heater 1030. Referring to FIGS. 2 and 3, the aerosol FIG. 9 is a cross-sectional view illustrating a modified",40
"5 EP 3 821 723 A1 generating device 1000 may further include a vaporizer 1040. Also, the cigarette 2000 may be inserted into an inner space of the aerosol generating device 1000. [0034] FIGS. 1 through 3 illustrate components of the aerosol generating device 1000, which are related to the present embodiment. Therefore, it will be understood by one of ordinary skill in the art related to the present em- bodiment that other general-purpose components may be further included in the aerosol generating device 1000, in addition to the components illustrated in FIGS. 1 through 3. [0035] Also, FIGS. 2 and 3 illustrate the aerosol gen- erating device 1000 including the heater 1030. However, according to necessity, the heater 1030 may be omitted. [0036] FIG. 1 illustrates that the battery 1010, the con- troller 1020, and the heater 1030 are arranged in series. Also, FIG. 2 illustrates that the battery 1010, the controller 1020, the vaporizer 1040, and the heater 1030 are ar- ranged in series. Also, FIG. 3 illustrates that the vaporizer 1040 and the heater 1030 are arranged in parallel. How- ever, the internal structure of the aerosol generating de- vice 1000 is not limited to the structures illustrated in FIGS. 1 through 3. In other words, according to the design of the aerosol generating device 1000, the battery 1010, the controller 1020, the heater 1030, and the vaporizer 1040 may be differently arranged. [0037] When the cigarette 2000 is inserted into the aer- osol generating device 1000, the aerosol generating de- vice 1000 may operate the heater 1030 and/or the va- porizer 1040 to generate an aerosol from the cigarette 2000 and/or the vaporizer 1040. The aerosol generated by the heater 1030 and/or the vaporizer 1040 is delivered to a user by passing through the cigarette 2000. [0038] According to necessity, even when the cigarette 2000 is not inserted into the aerosol generating device 1000, the aerosol generating device 1000 may heat the heater 1030. [0039] The battery 1010 may supply power to be used for the aerosol generating device 1000 to operate. For example, the battery 1010 may supply power to heat the heater 1030 or the vaporizer 1040, and may supply power for operating the controller 1020. Also, the battery 1010 may supply power for operations of a display, a sensor, a motor, etc. mounted in the aerosol generating device 1000 [0040] The controller 1020 may generally control op- erations of the aerosol generating device 1000. In detail, the controller 1020 may control not only operations of the battery 1010, the heater 1030, and the vaporizer 1040, but also operations of other components included in the aerosol generating device 1000. Also, the controller 1020 may check a state of each of the components of the aer- osol generating device 1000 to determine whether or not the aerosol generating device 1000 is able to operate. [0041] The controller 1020 may include at least one processor. A processor can be implemented as an array of a plurality of logic gates or can be implemented as a combination of a general-purpose microprocessor and a 6 memory in which a program executable in the microproc- essor is stored. It will be understood by one of ordinary skill in the art that the processor can be implemented in other forms of hardware. 5 [0042] The heater 1030 may be heated by the power supplied from the battery 1010. For example, when the cigarette 2000 is inserted into the aerosol generating de- vice 1000, the heater 1030 may be located outside the cigarette 2000. Thus, the heated heater 1030 may in- 10 crease a temperature of an aerosol generating material in the cigarette 2000. [0043] The heater 1030 may include an electro-resis- tive heater. For example, the heater 1030 may include an electrically conductive track, and the heater 1030 may 15 be heated when currents flow through the electrically conductive track. However, the heater 1030 is not limited to the example described above and may include all heat- ers which may be heated to a desired temperature. Here, the desired temperature may be pre-set in the aerosol 20 generating device 1000 or may be set as a temperature desired by a user. [0044] As another example, the heater 1030 may in- clude an induction heater. In detail, the heater 1030 may include an electrically conductive coil for heating a ciga- rette in an induction heating method, and the cigarette may include a susceptor which may be heated by the induction heater. 25 [0045] For example, the heater 1030 may include a tube-type heating element, a plate-type heating element, a needle-type heating element, or a rod-type heating el- ement, and may heat the inside or the outside of the cigarette 2000, according to the shape of the heating element. 30 35 [0046] Also, the aerosol generating device 1000 may include a plurality of heaters 1030. Here, the plurality of heaters 1030 may be inserted into the cigarette 2000 or may be arranged outside the cigarette 2000. Also, some of the plurality of heaters 1030 may be inserted into the cigarette 2000 and the others may be arranged outside 40 the cigarette 2000. In addition, the shape of the heater 1030 is not limited to the shapes illustrated in FIGS. 1 through 3 and may include various shapes. 45 [0047] The vaporizer 1040 may generate an aerosol by heating a liquid composition and the generated aero- sol may pass through the cigarette 2000 to be delivered to a user. In other words, the aerosol generated via the vaporizer 1040 may move along an air flow passage of the aerosol generating device 1000 and the air flow pas- sage may be configured such that the aerosol generated via the vaporizer 1040 passes through the cigarette 2000 to be delivered to the user. 50 [0048] For example, the vaporizer 1040 may include a liquid storage, a liquid delivery element, and a heating element, but it is not limited thereto. For example, the liquid storage, the liquid delivery element, and the heating element may be included in the aerosol generating de- vice 1000 as independent modules. [0049] The liquid storage may store a liquid composi- 55 4",41
"7 EP 3 821 723 A1 tion. For example, the liquid composition may be a liquid including a tobacco-containing material having a volatile tobacco flavor component, or a liquid including a non- tobacco material. The liquid storage may be formed to be detachable from the vaporizer 1040 or may be formed integrally with the vaporizer 1040. [0050] For example, the liquid composition may in- clude water, a solvent, ethanol, plant extract, spices, fla- vorings, or a vitamin mixture. The spices may include menthol, peppermint, spearmint oil, and various fruit-fla- vored ingredients, but are not limited thereto. The flavor- ings may include ingredients capable of providing various flavors or tastes to a user. Vitamin mixtures may be a mixture of at least one of vitamin A, vitamin B, vitamin C, and vitamin E, but are not limited thereto. Also, the liquid composition may include an aerosol forming substance, such as glycerin and propylene glycol. [0051] The liquid delivery element may deliver the liq- uid composition of the liquid storage to the heating ele- ment. For example, the liquid delivery element may be a wick such as cotton fiber, ceramic fiber, glass fiber, or porous ceramic, but is not limited thereto. [0052] The heating element is an element for heating the liquid composition delivered by the liquid delivery el- ement. For example, the heating element may be a metal heating wire, a metal hot plate, a ceramic heater, or the like, but is not limited thereto. In addition, the heating element may include a conductive filament such as ni- chrome wire and may be positioned as being wound around the liquid delivery element. The heating element may be heated by a current supply and may transfer heat to the liquid composition in contact with the heating ele- ment, thereby heating the liquid composition. As a result, aerosol may be generated. [0053] For example, the vaporizer 1040 may be re- ferred to as a cartomizer or an atomizer, but it is not limited thereto. [0054] The aerosol generating device 1000 may fur- ther include general-purpose components in addition to the battery 1010, the controller 1020, the heater 1030, and the vaporizer 1040. For example, the aerosol gen- erating device 1000 may include a display capable of outputting visual information and/or a motor for outputting haptic information. Also, the aerosol generating device 1000 may include at least one sensor (a puff detecting sensor, a temperature detecting sensor, a cigarette in- sertion detecting sensor, etc.). Also, the aerosol gener- ating device 1000 may be formed as a structure where, even when the cigarette 2000 is inserted into the aerosol generating device 1000, external air may be introduced or internal air may be discharged. [0055] Although not illustrated in FIGS. 1 through 3, the aerosol generating device 1000 and an additional cradle may form together a system. For example, the cradle may be used to charge the battery 1010 of the aerosol generating device 1000. Alternatively, the heater 1030 may be heated when the cradle and the aerosol generating device 1000 are coupled to each other. 8 [0056] The cigarette 2000 may be similar as a general combustive cigarette. For example, the cigarette 2000 may be divided into a first portion including an aerosol generating material and a second portion including a fil- 5 ter, etc. Alternatively, the second portion of the cigarette 2000 may also include an aerosol generating material. For example, an aerosol generating material made in the form of granules or capsules may be inserted into the second portion. 10 [0057] The entire first portion may be inserted into the aerosol generating device 1000, and the second portion may be exposed to the outside. Alternatively, only a por- tion of the first portion may be inserted into the aerosol generating device 1000. Otherwise, the entire first portion 15 and a portion of the second portion may be inserted into the aerosol generating device 1000. The user may puff aerosol while holding the second portion by the mouth of the user. In this case, the aerosol is generated by the external air passing through the first portion, and the gen- 20 erated aerosol passes through the second portion and is delivered to the user's mouth. [0058] For example, the external air may flow into at least one air passage formed in the aerosol generating device 1000. For example, opening and closing of the air passage and/or a size of the air passage may be adjusted by the user. Accordingly, the amount of smoke and a smoking satisfaction may be adjusted by the user. As another example, the external air may flow into the cig- arette 2000 through at least one hole formed in a surface of the cigarette 2000. 25 30 [0059] Hereinafter, an example of the cigarette 2000 will be described with reference to FIG. 4. [0060] FIG. 4 illustrates an example of a cigarette. [0061] Referring to FIG. 4, the cigarette 2000 may in- clude a tobacco rod 2050 and a filter rod 2200. The first portion described above with reference to FIGS. 1 through 3 may include the tobacco rod 2050, and the second portion may include the filter rod 2200. 35 [0062] FIG. 4 illustrates that the filter rod 2200 includes 40 a single segment. However, the filter rod 2200 is not lim- ited thereto. In other words, the filter rod 2200 may in- clude a plurality of segments. For example, the filter rod 2200 may include a first segment configured to cool aer- osol and a second segment configured to filter a certain component included in the aerosol. Also, as necessary, the filter rod 2200 may further include at least one seg- ment configured to perform other functions. 45 50 [0063] The cigarette 2000 may be packaged using at least one wrapper 2350. The wrapper 2350 may have at least one hole through which external air may be intro- duced or internal air may be discharged. For example, the cigarette 2000 may be packaged using one wrapper 2350. As another example, the cigarette 2000 may be double-packaged using at least two wrappers 2350. For example, the tobacco rod 2050 may be packaged using a first wrapper, and the filter rod 2200 may be packaged using a second wrapper. Also, the tobacco rod 2050 and the filter rod 2200, which are respectively packaged using 55 5",42
